{"schema_version":"1","report_id":"complete-mp-corbyn-fixture-v1","title":"Complete MP Report fixture — Corbyn, Jeremy","generated_at":"2026-07-20T15:53:04Z","subject":{"display_name":"Corbyn, Jeremy","sort_name":"Corbyn, Jeremy","parliament_member_id":"185","current_constituency":"Islington North","current_party":"Your Party","identity_status":"verified","identity_source_ids":["source-uk-parliament-member-career","source-uk-parliament-2024-election-result"],"notes":"Official UK Parliament records verify the member ID, current constituency, current parliamentary affiliation and continuous service start. The repository retains surname-first presentation for deterministic output compatibility."},"scope":{"scope_statement":"Fixture proof of the canonical Complete MP Report v1 structure and generator, now including a bounded official UK Parliament identity and parliamentary-service baseline. Other research lanes remain incomplete.","as_of_date":"2026-07-20","geographic_scope":"UK Parliament public record","houses":["House of Commons"],"career_start_date":"1983-06-09","career_end_date":null,"notes":"UK Parliament verifies continuous Commons service since 9 June 1983. The identity-and-career section remains partial because the full historic election and boundary chronology has not been independently assessed."},"publication":{"status":"not_ready","human_review_required":true,"public_output_authorised":false,"approved_by":null,"approved_at":null,"notes":"Fixture output must not be treated as a public profile."},"sections":[{"section_id":"identity_and_parliamentary_career","title":"Identity and parliamentary career","status":"partial","summary":"Official UK Parliament records verify member ID 185, current Islington North representation, current Your Party affiliation and continuous Commons service since 9 June 1983; the full career chronology remains partial.","fact_ids":["fact-fixture-member-id","fact-current-constituency","fact-continuous-commons-service","fact-representation-1983-1997","fact-representation-1997-2010","fact-representation-2010-2024","fact-representation-2024-present","fact-party-labour-1983-2020","fact-party-independent-2020-2026","fact-party-your-party-2026-present","fact-2024-election-independent"],"claim_ids":[],"interpretation_ids":[],"relationship_ids":[],"gap_ids":["gap-identity-refresh","gap-career-history-scope"]},{"section_id":"roles_and_committees","title":"Roles and committees","status":"partial","summary":"Official UK Parliament records identify one current parliamentary-leadership post, two previous leadership posts and two committee memberships; exhaustive historic role and committee coverage is not claimed.","fact_ids":["fact-role-parliamentary-leader-your-party","fact-role-labour-party-leader-2015-2020","fact-role-official-opposition-leader-2015-2020","fact-committee-social-security-1992-1997","fact-committee-justice-2011-2015"],"claim_ids":[],"interpretation_ids":[],"relationship_ids":[],"gap_ids":["gap-role-committee-history-scope"]},{"section_id":"voting_record_and_coverage","title":"Voting record and coverage","status":"partial","summary":"Repository machinery exists for available Commons votes and controlled historic batches, but complete coverage is not established.","fact_ids":["fact-vote-workflow-exists","fact-historic-plan-range"],"claim_ids":["claim-vote-coverage-partial"],"interpretation_ids":[],"relationship_ids":[],"gap_ids":["gap-historic-votes"]},{"section_id":"financial_interests","title":"Financial interests","status":"partial","summary":"Official UK Parliament records show 29 entries in the current published snapshot dated 13 July 2026; historical coverage remains incomplete because the current display is subject to a twelve-month retention boundary.","fact_ids":["fact-financial-interest-001","fact-financial-interest-002","fact-financial-interest-003","fact-financial-interest-004","fact-financial-interest-005","fact-financial-interest-006","fact-financial-interest-007","fact-financial-interest-008","fact-financial-interest-009","fact-financial-interest-010","fact-financial-interest-011","fact-financial-interest-012","fact-financial-interest-013","fact-financial-interest-014","fact-financial-interest-015","fact-financial-interest-016","fact-financial-interest-017","fact-financial-interest-018","fact-financial-interest-019","fact-financial-interest-020","fact-financial-interest-021","fact-financial-interest-022","fact-financial-interest-023","fact-financial-interest-024","fact-financial-interest-025","fact-financial-interest-026","fact-financial-interest-027","fact-financial-interest-028","fact-financial-interest-029"],"claim_ids":[],"interpretation_ids":[],"relationship_ids":[],"gap_ids":["gap-financial-interests-history-retention"]},{"section_id":"donations_and_political_finance","title":"Donations and political finance","status":"not_researched","summary":"No political-finance records are present.","fact_ids":[],"claim_ids":[],"interpretation_ids":[],"relationship_ids":[],"gap_ids":["gap-donations"]},{"section_id":"outside_work_and_company_links","title":"Outside work and company links","status":"not_researched","summary":"No outside-work or company-link records are present.","fact_ids":[],"claim_ids":[],"interpretation_ids":[],"relationship_ids":[],"gap_ids":["gap-outside-work"]},{"section_id":"speeches_and_questions","title":"Speeches and parliamentary questions","status":"not_researched","summary":"No Hansard or parliamentary-question records are present.","fact_ids":[],"claim_ids":[],"interpretation_ids":[],"relationship_ids":[],"gap_ids":["gap-speeches-questions"]},{"section_id":"public_positions_over_time","title":"Public positions over time","status":"not_researched","summary":"No reviewed position timeline is present.","fact_ids":[],"claim_ids":[],"interpretation_ids":[],"relationship_ids":[],"gap_ids":["gap-positions"]},{"section_id":"changes_and_contradictions","title":"Changes and contradictions","status":"human_review_required","summary":"No contradiction claim should be made until dated positions and explanations are reviewed.","fact_ids":[],"claim_ids":[],"interpretation_ids":[],"relationship_ids":[],"gap_ids":["gap-contradictions"]},{"section_id":"organisations_and_relationships","title":"Organisations and evidenced relationships","status":"not_researched","summary":"No real relationship records are present in the fixture.","fact_ids":[],"claim_ids":[],"interpretation_ids":[],"relationship_ids":[],"gap_ids":["gap-relationships"]},{"section_id":"evidence_gaps","title":"Evidence gaps","status":"partial","summary":"The fixture explicitly records major evidence and access gaps.","fact_ids":["fact-server-live-state-unverified"],"claim_ids":[],"interpretation_ids":[],"relationship_ids":[],"gap_ids":["gap-server-inventory"]},{"section_id":"source_register","title":"Source register","status":"partial","summary":"Official UK Parliament identity sources are registered, but authoritative public sources for most report sections remain incomplete.","fact_ids":[],"claim_ids":[],"interpretation_ids":[],"relationship_ids":[],"gap_ids":["gap-source-authority"]},{"section_id":"human_review","title":"Human review","status":"human_review_required","summary":"Only the fixture boundary has been reviewed; substantive review remains outstanding.","fact_ids":[],"claim_ids":[],"interpretation_ids":[],"relationship_ids":[],"gap_ids":["gap-human-review"]}],"sources":[{"source_id":"source-uk-parliament-member-career","title":"Parliamentary career for Jeremy Corbyn","publisher":"UK Parliament","source_type":"parliamentary_record","authority_level":"primary","url":"https://members.parliament.uk/member/185/career","repository_path":"","server_path":"","publication_date":null,"capture_date":"2026-07-20","coverage_from":"1983-06-09","coverage_to":null,"checksum":"","limitations":"Records the current and previous parliamentary representations, parliamentary party affiliations and selected posts shown on the official member career page. It does not independently establish every election, boundary or administrative event across the full career."},{"source_id":"source-uk-parliament-2024-election-result","title":"Last election result for Jeremy Corbyn","publisher":"UK Parliament","source_type":"electoral_record","authority_level":"primary","url":"https://members.parliament.uk/member/185/electionresult","repository_path":"","server_path":"","publication_date":"2024-07-04","capture_date":"2026-07-20","coverage_from":"2024-07-04","coverage_to":"2024-07-04","checksum":"","limitations":"Records the 4 July 2024 general-election result and the candidate's affiliation at that election. It does not describe later parliamentary affiliation changes."},{"source_id":"source-mp-query-fixture","title":"MP full vote query fixture","publisher":"Story Evidence Collector repository","source_type":"repository_fixture","authority_level":"fixture_only","url":"","repository_path":"mp_full_vote_query.json","server_path":"","publication_date":null,"capture_date":"2026-07-14","coverage_from":null,"coverage_to":null,"checksum":"","limitations":"Contains project-supplied identity fields that explicitly require official verification."},{"source_id":"source-vote-builder","title":"Available-source MP vote index builder","publisher":"Story Evidence Collector repository","source_type":"repository_fixture","authority_level":"fixture_only","url":"","repository_path":"build_mp_full_vote_index_v13.py","server_path":"","publication_date":null,"capture_date":"2026-07-14","coverage_from":"2016-01-01","coverage_to":null,"checksum":"","limitations":"Provides available Commons Votes API workflow, not verified complete career coverage."},{"source_id":"source-parlparse-plan","title":"ParlParse import batch plan v1.9","publisher":"Story Evidence Collector repository","source_type":"repository_fixture","authority_level":"fixture_only","url":"","repository_path":"parlparse_import_batch_plan_v19.json","server_path":"","publication_date